{
  "contract_version": "1.0.1",
  "id": "reducido",
  "name": "Espacio reducido",
  "description": "Radios de las 5 zonas originales ×1.5 y zona nueva bloqueo_australia_este que corta el casquete útil de Australia; alimenta la prueba de espacio reducido del Entregable 3.",
  "n_sats": 8,
  "footprint_deg": 10.0,
  "regions": [
    {"id": "yucatan",    "name": "Península de Yucatán, México", "lat": 20.5,  "lon": -89.0,  "priority": "Alta",   "weight": 3, "radius_deg": 2.7},
    {"id": "amazonia",   "name": "Amazonía brasileña",           "lat": -3.5,  "lon": -62.0,  "priority": "Alta",   "weight": 3, "radius_deg": 2.7},
    {"id": "california", "name": "California, Estados Unidos",   "lat": 36.8,  "lon": -119.4, "priority": "Media",  "weight": 2, "radius_deg": 2.7},
    {"id": "sahel",      "name": "Región del Sahel, África",     "lat": 15.0,  "lon": 0.0,    "priority": "Media",  "weight": 2, "radius_deg": 2.7},
    {"id": "japon",      "name": "Japón",                        "lat": 36.0,  "lon": 138.0,  "priority": "Media",  "weight": 2, "radius_deg": 2.7},
    {"id": "australia",  "name": "Interior de Australia",        "lat": -25.0, "lon": 133.0,  "priority": "Normal", "weight": 1, "radius_deg": 2.7}
  ],
  "debris_zones": [
    {"id": "atlantico_norte",        "name": "Atlántico Norte",         "lat": 45.0,  "lon": -35.0,  "radius_deg": 18.0},
    {"id": "pacifico_sur",           "name": "Pacífico Sur",            "lat": -30.0, "lon": -120.0, "radius_deg": 15.0},
    {"id": "polar_norte",            "name": "Región polar norte",      "lat": 78.0,  "lon": 30.0,   "radius_deg": 12.0},
    {"id": "bloqueo_australia_este", "name": "Bloqueo Australia este",  "lat": -25.0, "lon": 141.0,  "radius_deg": 6.0}
  ],
  "occupied": [
    {"id": "objeto_a", "name": "Objeto A", "lat": 10.0,  "lon": 45.0,  "radius_deg": 7.5},
    {"id": "objeto_b", "name": "Objeto B", "lat": -15.0, "lon": 110.0, "radius_deg": 7.5}
  ],
  "fitness": {"k_penalty": 0.5, "redundancy_bonus": 0.05}
}
